{
  "path": "example_value",
  "accountId": "500123",
  "containerId": "500123",
  "workspaceId": "500123",
  "triggerId": "500123",
  "name": "Example Title",
  "type": "example_value",
  "customEventFilter": [],
  "filter": [],
  "autoEventFilter": [],
  "fingerprint": "example_value",
  "parentFolderId": "500123",
  "tagManagerUrl": "https://www.example.com",
  "notes": "example_value",
  "parameter": []
}